{
  "schema_version": 1,
  "device_id": "BB-AABBCC112233",
  "binding_id": "97fcde45-4112-41d4-a509-17e5bb1c0d91",
  "boot_id": "2cfaa1ad-48c9-46f3-bd8e-5ebf68790dd1",
  "seq": 8,
  "capture_uptime_ms": 301000,
  "time_quality": "synchronized",
  "created_at": "2026-10-16T03:00:01Z",
  "command_id": "38e2d9ab-a634-4be1-9b4f-b1ef96c5bb3b",
  "result": "accepted",
  "reason": "queued",
  "observed_on": false
}
